{
  "schema_version": "vc-tokmeter.upload.v1",
  "artifact_type": "vc-tokmeter.upload",
  "created_at": "2026-07-05T16:00:00Z",
  "upload_id": "upl_20260705_0001",
  "client": {
    "tokmeter_version": "0.1.0",
    "surface": "codex-tui",
    "surface_detail": "subscription",
    "platform": {
      "os": "macos",
      "arch": "arm64"
    }
  },
  "consent": {
    "upload_opt_in": true,
    "consent_version": "2026-07-05",
    "tester_alias": "tester-01",
    "contact_ok": false
  },
  "study": {
    "study_id": "git-workflow-token-study",
    "protocol_version": "v1",
    "cohort": "pilot"
  },
  "session": {
    "session_id_hash": "0123456789abcdef",
    "repo_hash": "abcdef0123456789",
    "time_bucket_utc": "2026-07-05T15:00:00Z",
    "duration_seconds": 2460,
    "timezone_offset_minutes": -240
  },
  "metrics": {
    "evidence_grade": "O",
    "token_fidelity": "mixed",
    "summary": {
      "runs": 1,
      "tasks": 1,
      "events": 42,
      "total_tokens": 3137063,
      "input_tokens": 1200000,
      "output_tokens": 1937063,
      "cache_read_tokens": 0,
      "cache_write_tokens": 0,
      "bytes": 1272906
    },
    "session_git_share": {
      "total_tokens": 3137063,
      "git_tokens": 443,
      "non_git_tokens": 3136620,
      "git_token_share": 0.000141,
      "fidelity": "estimated"
    },
    "token_sources": [
      {
        "source": "proxy estimate",
        "events": 138,
        "total_tokens": 1044541,
        "input_tokens": 0,
        "output_tokens": 1044541,
        "cache_read_tokens": 0,
        "cache_write_tokens": 0,
        "bytes": 3802609,
        "token_share": 0.333
      },
      {
        "source": "hook response",
        "events": 40,
        "total_tokens": 4840,
        "input_tokens": 0,
        "output_tokens": 4840,
        "cache_read_tokens": 0,
        "cache_write_tokens": 0,
        "bytes": 33214,
        "token_share": 0.0015
      }
    ],
    "git_workflow": {
      "totals": {
        "runs": 1,
        "tasks": 1,
        "events": 4,
        "total_tokens": 443,
        "input_tokens": 78,
        "output_tokens": 365,
        "cache_read_tokens": 0,
        "cache_write_tokens": 0,
        "bytes": 2216
      },
      "action_subtypes": [
        {
          "action_subtype": "git.status",
          "direction": "response",
          "operation_class": "version_control",
          "events": 2,
          "total_tokens": 180,
          "input_tokens": 0,
          "output_tokens": 180,
          "cache_read_tokens": 0,
          "cache_write_tokens": 0,
          "bytes": 900,
          "token_share": 0.000057
        },
        {
          "action_subtype": "git.diff",
          "direction": "response",
          "operation_class": "version_control",
          "events": 2,
          "total_tokens": 263,
          "input_tokens": 0,
          "output_tokens": 263,
          "cache_read_tokens": 0,
          "cache_write_tokens": 0,
          "bytes": 1316,
          "token_share": 0.000084
        }
      ]
    },
    "warnings": ["observational_only", "mixed_fidelity"]
  },
  "redaction": {
    "source_artifact": "report-share",
    "digest_hex_chars": 12,
    "salt_scope": "tester-local",
    "private_data_policy": "aggregate-only-no-raw-content"
  }
}
