{
  "schema_version": "vc-tokmeter.upload.v1",
  "artifact_type": "vc-tokmeter.upload",
  "created_at": "2026-07-05T15:30:00Z",
  "client": {
    "tokmeter_version": "0.1.0",
    "surface": "codex-tui",
    "platform": {
      "os": "macos",
      "arch": "arm64"
    }
  },
  "consent": {
    "upload_opt_in": true,
    "consent_version": "2026-07-05",
    "tester_alias": "tester-a",
    "contact_ok": false
  },
  "study": {
    "study_id": "metric-taker-t10",
    "protocol_version": "2026-07-05",
    "cohort": "collector-api"
  },
  "session": {
    "session_id_hash": "0123456789abcdef",
    "repo_hash": "abcdef0123456789",
    "time_bucket_utc": "2026-07-05T15:00:00Z",
    "duration_seconds": 1800,
    "timezone_offset_minutes": -240
  },
  "metrics": {
    "evidence_grade": "O",
    "token_fidelity": "mixed",
    "summary": {
      "runs": 1,
      "tasks": 2,
      "events": 8,
      "total_tokens": 1200,
      "input_tokens": 700,
      "output_tokens": 500,
      "cache_read_tokens": 0,
      "cache_write_tokens": 0,
      "bytes": 4096
    },
    "session_git_share": {
      "total_tokens": 1200,
      "git_tokens": 240,
      "non_git_tokens": 960,
      "git_token_share": 0.2,
      "fidelity": "mixed"
    },
    "token_sources": [
      {
        "source": "codex exec exact usage",
        "events": 8,
        "total_tokens": 1200,
        "input_tokens": 700,
        "output_tokens": 500,
        "bytes": 4096,
        "token_share": 1.0
      }
    ],
    "git_workflow": {
      "totals": {
        "runs": 1,
        "tasks": 2,
        "events": 2,
        "total_tokens": 240,
        "input_tokens": 160,
        "output_tokens": 80,
        "cache_read_tokens": 0,
        "cache_write_tokens": 0,
        "bytes": 1024
      },
      "action_subtypes": [
        {
          "action_subtype": "git.status",
          "direction": "request",
          "operation_class": "version_control",
          "events": 1,
          "total_tokens": 80,
          "input_tokens": 80,
          "output_tokens": 0,
          "bytes": 512,
          "token_share": 0.0666666667
        },
        {
          "action_subtype": "git.diff",
          "direction": "response",
          "operation_class": "version_control",
          "events": 1,
          "total_tokens": 160,
          "input_tokens": 80,
          "output_tokens": 80,
          "bytes": 512,
          "token_share": 0.1333333333
        }
      ]
    },
    "warnings": [
      "observational_only"
    ]
  },
  "redaction": {
    "source_artifact": "report-share",
    "digest_hex_chars": 16,
    "salt_scope": "tester-local",
    "private_data_policy": "aggregate-only-no-raw-content"
  }
}
